id,en,pt_BR
forest-1-1,,Herói: O que está acontecendo.
forest-1-2,,Herói: Eu não me lembro do que aconteceu.
forest-1-3,,"Herói: Eu estou caído nesse local escuro, sem nenhuma pista."
forest-1-4,,"Herói: Nossa, é verdade. Lembro-me de estar lutando com algo, mas acabei caindo..."
forest-1-5,,"Herói: O que está acontecendo, tudo está tremendo."
forest-1-6,,"Herói: De quem é essa voz...Minha cabeça está doendo, mas não consigo me lembrar. De qualquer forma, estão pedindo por ajuda, e o que posso fazer é me mexer e ir encontrar essa voz."